{
  "version": "1.0",
  "type": "waterfall",
  "title": "Procurement savings more than offset inflation, lifting margin by 2.1 points",
  "subtitle": "Operating margin bridge, FY25 to FY26, % of revenue",
  "footer": { "source": "Fictitious data" },
  "body": {
    "format": { "suffix": "%", "decimals": 1 },
    "steps": [
      { "label": "FY25 margin", "value": 12.4, "kind": "start" },
      { "label": "Price increases", "value": 1.8 },
      { "label": "Wage inflation", "value": -1.6 },
      { "label": "Energy costs", "value": -0.7 },
      { "label": "Procurement savings", "value": 2.9, "emphasis": "accent" },
      { "label": "Mix effects", "value": -0.3 },
      { "label": "FY26 margin", "kind": "end" }
    ]
  }
}
