{
  "version": "1.0",
  "type": "exhibit",
  "title": "Shared hubs let every division charge where power is cheapest, saving £300m a year by 2040",
  "footnotes": ["Charging cost combines capital and operating expenditure for grid connections, chargers and electricity", "Each division builds and runs its own charging"],
  "footer": { "source": "Fleet electrification model; fictitious data" },
  "body": {
    "layout": "columns",
    "panels": [
      {
        "id": "why",
        "type": "narrative",
        "span": 1,
        "body": {
          "paragraphs": ["Investing in shared grid connections unlocks cheaper charging for every division."],
          "bullets": [
            { "lead": "£110 million a year", "text": "in grid connections and hubs to charge over 9,000 vans by 2040" },
            { "lead": "£350 million lower", "text": "electricity cost as pooled sites buy power at volume and off-peak" },
            { "lead": "Over £2 billion", "text": "saved in total charging costs to 2040 against separate depots" }
          ]
        }
      },
      {
        "id": "costs",
        "type": "bar-chart",
        "span": 2.2,
        "title": "Annual fleet charging cost¹",
        "subtitle": "£ millions",
        "body": {
          "series": [
            { "id": "grid", "label": "Grid connections", "emphasis": "muted" },
            { "id": "chargers", "label": "Chargers" },
            { "id": "electricity", "label": "Electricity" }
          ],
          "categories": [
            { "id": "separate-2030", "label": "Own²", "group": "2030", "values": [20, 90, 260], "badge": 240 },
            { "id": "pooled-2030", "label": "Pooled", "group": "2030", "values": [30, 80, 200], "badge": 220 },
            { "id": "separate-2040", "label": "Own²", "group": "2040", "values": [10, 340, 1050], "badge": 820 },
            { "id": "pooled-2040", "label": "Pooled", "group": "2040", "values": [110, 290, 700], "badge": 760, "emphasis": "accent" }
          ],
          "deltas": [{ "from": "separate-2030", "to": "pooled-2030" }, { "from": "separate-2040", "to": "pooled-2040" }],
          "badges": { "label": "of which operating cost" }
        }
      },
      {
        "id": "headline",
        "type": "kpi",
        "span": 0.8,
        "body": {
          "layout": "column",
          "items": [
            { "id": "save-2030", "value": "£60M", "label": "lower annual cost in 2030" },
            { "id": "save-2040", "value": "£300M", "label": "lower annual cost in 2040", "emphasis": "accent" }
          ]
        }
      }
    ]
  }
}
