{
  "version": "1.0",
  "type": "line-chart",
  "title": "Online orders are back to their 2019 level after the relaunch; store visits keep falling",
  "subtitle": "Online orders and store visits, index (2019 = 100)",
  "footer": { "source": "Trading data; fictitious data" },
  "body": {
    "x": ["2018", "Q2", "Q3", "Q4", "2019", "Q2", "Q3", "Q4", "2020", "Q2", "Q3", "Q4", "2021", "Q2", "Q3", "Q4", "2022", "Q2", "Q3", "Q4", "2023"],
    "series": [
      { "id": "online", "label": "Online orders", "emphasis": "accent", "values": [96, 97, 99, 99, 100, 101, 101, 102, 98, 89, 94, 97, 99, 101, 102, 101, 100, 101, 99, 100, 100] },
      { "id": "stores", "label": "Store visits", "values": [104, 103, 102, 101, 100, 99, 98, 98, 96, 94, 93, 93, 92, 91, 91, 90, 90, 89, 89, 88, 88] }
    ],
    "reference": { "value": 100, "label": "2019 = 100" },
    "annotations": [{ "at": "2020", "label": "Website relaunch" }]
  }
}
